{
 "badge": "SYNTHETIC \u2014 invented records and fixture scores; not the historical snapshot",
 "candidates": [
  {
   "a_id": "SYN-A-001",
   "b_id": "SYN-B-001",
   "values": {
    "synthetic_exact_like": 1.0,
    "synthetic_rules_like": 1.0
   }
  },
  {
   "a_id": "SYN-A-001",
   "b_id": "SYN-B-002",
   "values": {
    "synthetic_exact_like": 1.0,
    "synthetic_rules_like": 1.0
   }
  },
  {
   "a_id": "SYN-A-002",
   "b_id": "SYN-B-003",
   "values": {
    "synthetic_exact_like": 1.0,
    "synthetic_rules_like": 0.98
   }
  },
  {
   "a_id": "SYN-A-002",
   "b_id": "SYN-B-004",
   "values": {
    "synthetic_exact_like": 0.0,
    "synthetic_rules_like": 0.93
   }
  },
  {
   "a_id": "SYN-A-003",
   "b_id": "SYN-B-005",
   "values": {
    "synthetic_exact_like": 0.0,
    "synthetic_rules_like": 0.8
   }
  },
  {
   "a_id": "SYN-A-003",
   "b_id": "SYN-B-006",
   "values": {
    "synthetic_exact_like": 0.0,
    "synthetic_rules_like": 0.76
   }
  },
  {
   "a_id": "SYN-A-004",
   "b_id": "SYN-B-007",
   "values": {
    "synthetic_exact_like": 1.0,
    "synthetic_rules_like": 0.97
   }
  },
  {
   "a_id": "SYN-A-006",
   "b_id": "SYN-B-008",
   "values": {
    "synthetic_exact_like": 1.0,
    "synthetic_rules_like": 0.95
   }
  },
  {
   "a_id": "SYN-A-006",
   "b_id": "SYN-B-009",
   "values": {
    "synthetic_exact_like": 0.0,
    "synthetic_rules_like": 0.6
   }
  },
  {
   "a_id": "SYN-A-007",
   "b_id": "SYN-B-010",
   "values": {
    "synthetic_exact_like": 1.0,
    "synthetic_rules_like": 0.99
   }
  },
  {
   "a_id": "SYN-A-007",
   "b_id": "SYN-B-009",
   "values": {
    "synthetic_exact_like": 0.0,
    "synthetic_rules_like": 0.2
   }
  },
  {
   "a_id": "SYN-A-008",
   "b_id": "SYN-B-012",
   "values": {
    "synthetic_exact_like": 1.0,
    "synthetic_rules_like": 0.99
   }
  },
  {
   "a_id": "SYN-A-008",
   "b_id": "SYN-B-011",
   "values": {
    "synthetic_exact_like": 0.0,
    "synthetic_rules_like": 0.7
   }
  },
  {
   "a_id": "SYN-A-009",
   "b_id": "SYN-B-014",
   "values": {
    "synthetic_exact_like": 0.0,
    "synthetic_rules_like": 0.3
   }
  },
  {
   "a_id": "SYN-A-010",
   "b_id": "SYN-B-014",
   "values": {
    "synthetic_exact_like": 1.0,
    "synthetic_rules_like": 1.0
   }
  },
  {
   "a_id": "SYN-A-010",
   "b_id": "SYN-B-016",
   "values": {
    "synthetic_exact_like": 0.0,
    "synthetic_rules_like": 0.4
   }
  },
  {
   "a_id": "SYN-A-011",
   "b_id": "SYN-B-015",
   "values": {
    "synthetic_exact_like": 0.0,
    "synthetic_rules_like": 0.7
   }
  },
  {
   "a_id": "SYN-A-011",
   "b_id": "SYN-B-016",
   "values": {
    "synthetic_exact_like": 0.0,
    "synthetic_rules_like": 0.1
   }
  },
  {
   "a_id": "SYN-A-012",
   "b_id": "SYN-B-016",
   "values": {
    "synthetic_exact_like": 0.0,
    "synthetic_rules_like": 0.35
   }
  }
 ],
 "cases": [
  {
   "a_id": "SYN-A-001",
   "case_id": "SYN-CASE-exact_tie_gap_zero",
   "expected": {
    "lowered_accept_0.75": {
     "synthetic_exact_like": {
      "ambiguous": true,
      "chosen_b_id": "SYN-B-001",
      "demoted": true,
      "gap": 0.0,
      "reason": "ambiguity_gap_below_threshold",
      "tier": "review",
      "top1_correct": false,
      "truth_reachable": true
     },
     "synthetic_rules_like": {
      "ambiguous": true,
      "chosen_b_id": "SYN-B-001",
      "demoted": true,
      "gap": 0.0,
      "reason": "ambiguity_gap_below_threshold",
      "tier": "review",
      "top1_correct": false,
      "truth_reachable": true
     }
    },
    "native_0.95_0.50_0.10": {
     "synthetic_exact_like": {
      "ambiguous": true,
      "chosen_b_id": "SYN-B-001",
      "demoted": true,
      "gap": 0.0,
      "reason": "ambiguity_gap_below_threshold",
      "tier": "review",
      "top1_correct": false,
      "truth_reachable": true
     },
     "synthetic_rules_like": {
      "ambiguous": true,
      "chosen_b_id": "SYN-B-001",
      "demoted": true,
      "gap": 0.0,
      "reason": "ambiguity_gap_below_threshold",
      "tier": "review",
      "top1_correct": false,
      "truth_reachable": true
     }
    },
    "wide_gap_0.25": {
     "synthetic_exact_like": {
      "ambiguous": true,
      "chosen_b_id": "SYN-B-001",
      "demoted": true,
      "gap": 0.0,
      "reason": "ambiguity_gap_below_threshold",
      "tier": "review",
      "top1_correct": false,
      "truth_reachable": true
     },
     "synthetic_rules_like": {
      "ambiguous": true,
      "chosen_b_id": "SYN-B-001",
      "demoted": true,
      "gap": 0.0,
      "reason": "ambiguity_gap_below_threshold",
      "tier": "review",
      "top1_correct": false,
      "truth_reachable": true
     }
    }
   },
   "purpose": "Two identical B masters tie at the top: gap 0, review under any positive gap threshold; the lexically smaller B id is the chosen one."
  },
  {
   "a_id": "SYN-A-002",
   "case_id": "SYN-CASE-near_gap_demotion",
   "expected": {
    "lowered_accept_0.75": {
     "synthetic_exact_like": {
      "ambiguous": false,
      "chosen_b_id": "SYN-B-003",
      "demoted": false,
      "gap": 1.0,
      "reason": "value_at_or_above_accept_min",
      "tier": "auto_accept",
      "top1_correct": true,
      "truth_reachable": true
     },
     "synthetic_rules_like": {
      "ambiguous": true,
      "chosen_b_id": "SYN-B-003",
      "demoted": true,
      "gap": 0.04999999999999993,
      "reason": "ambiguity_gap_below_threshold",
      "tier": "review",
      "top1_correct": true,
      "truth_reachable": true
     }
    },
    "native_0.95_0.50_0.10": {
     "synthetic_exact_like": {
      "ambiguous": false,
      "chosen_b_id": "SYN-B-003",
      "demoted": false,
      "gap": 1.0,
      "reason": "value_at_or_above_accept_min",
      "tier": "auto_accept",
      "top1_correct": true,
      "truth_reachable": true
     },
     "synthetic_rules_like": {
      "ambiguous": true,
      "chosen_b_id": "SYN-B-003",
      "demoted": true,
      "gap": 0.04999999999999993,
      "reason": "ambiguity_gap_below_threshold",
      "tier": "review",
      "top1_correct": true,
      "truth_reachable": true
     }
    },
    "wide_gap_0.25": {
     "synthetic_exact_like": {
      "ambiguous": false,
      "chosen_b_id": "SYN-B-003",
      "demoted": false,
      "gap": 1.0,
      "reason": "value_at_or_above_accept_min",
      "tier": "auto_accept",
      "top1_correct": true,
      "truth_reachable": true
     },
     "synthetic_rules_like": {
      "ambiguous": true,
      "chosen_b_id": "SYN-B-003",
      "demoted": true,
      "gap": 0.04999999999999993,
      "reason": "ambiguity_gap_below_threshold",
      "tier": "review",
      "top1_correct": true,
      "truth_reachable": true
     }
    }
   },
   "purpose": "Top value above accept_min but the runner-up is within the gap: demoted to review at gap 0.10; wide_gap_0.25 keeps it there."
  },
  {
   "a_id": "SYN-A-003",
   "case_id": "SYN-CASE-regression_0_80_0_76",
   "expected": {
    "lowered_accept_0.75": {
     "synthetic_exact_like": {
      "ambiguous": false,
      "chosen_b_id": "SYN-B-005",
      "demoted": false,
      "gap": 0.0,
      "reason": "value_below_review_min",
      "tier": "reject",
      "top1_correct": true,
      "truth_reachable": true
     },
     "synthetic_rules_like": {
      "ambiguous": true,
      "chosen_b_id": "SYN-B-005",
      "demoted": true,
      "gap": 0.040000000000000036,
      "reason": "ambiguity_gap_below_threshold",
      "tier": "review",
      "top1_correct": true,
      "truth_reachable": true
     }
    },
    "native_0.95_0.50_0.10": {
     "synthetic_exact_like": {
      "ambiguous": false,
      "chosen_b_id": "SYN-B-005",
      "demoted": false,
      "gap": 0.0,
      "reason": "value_below_review_min",
      "tier": "reject",
      "top1_correct": true,
      "truth_reachable": true
     },
     "synthetic_rules_like": {
      "ambiguous": true,
      "chosen_b_id": "SYN-B-005",
      "demoted": false,
      "gap": 0.040000000000000036,
      "reason": "ambiguity_gap_below_threshold",
      "tier": "review",
      "top1_correct": true,
      "truth_reachable": true
     }
    },
    "wide_gap_0.25": {
     "synthetic_exact_like": {
      "ambiguous": false,
      "chosen_b_id": "SYN-B-005",
      "demoted": false,
      "gap": 0.0,
      "reason": "value_below_review_min",
      "tier": "reject",
      "top1_correct": true,
      "truth_reachable": true
     },
     "synthetic_rules_like": {
      "ambiguous": true,
      "chosen_b_id": "SYN-B-005",
      "demoted": false,
      "gap": 0.040000000000000036,
      "reason": "ambiguity_gap_below_threshold",
      "tier": "review",
      "top1_correct": true,
      "truth_reachable": true
     }
    }
   },
   "purpose": "The mandatory regression: values 0.80 and 0.76. Review at accept 0.95; lowering accept to 0.75 must still give review (gap 0.04 < 0.10); the legacy flag reuse would accept it."
  },
  {
   "a_id": "SYN-A-004",
   "case_id": "SYN-CASE-single_candidate",
   "expected": {
    "lowered_accept_0.75": {
     "synthetic_exact_like": {
      "ambiguous": false,
      "chosen_b_id": "SYN-B-007",
      "demoted": false,
      "gap": null,
      "reason": "value_at_or_above_accept_min",
      "tier": "auto_accept",
      "top1_correct": true,
      "truth_reachable": true
     },
     "synthetic_rules_like": {
      "ambiguous": false,
      "chosen_b_id": "SYN-B-007",
      "demoted": false,
      "gap": null,
      "reason": "value_at_or_above_accept_min",
      "tier": "auto_accept",
      "top1_correct": true,
      "truth_reachable": true
     }
    },
    "native_0.95_0.50_0.10": {
     "synthetic_exact_like": {
      "ambiguous": false,
      "chosen_b_id": "SYN-B-007",
      "demoted": false,
      "gap": null,
      "reason": "value_at_or_above_accept_min",
      "tier": "auto_accept",
      "top1_correct": true,
      "truth_reachable": true
     },
     "synthetic_rules_like": {
      "ambiguous": false,
      "chosen_b_id": "SYN-B-007",
      "demoted": false,